Id,profile,titles,companies,links,data,date_listed
0,Data Scientist,Data Scientist,"dbSeerMcLean, VA 22102",http://www.indeed.com/rc/clk?jk=0f17ec594bc97b90&bb=E5D0-e-RDhZJMYuphDBGvtgMcvFCWCddSeKQF2syTyxawXySAJDAk9_FUOdXwJhjqNgq9GW6vRNXIr7x-8HoYwHnUg40JsSyNgUS9I3aOpk4O8NaFaNvmhjrRC0wfwES&xkcb=SoCl67M3CNkCGdQ8MZ1VbzkdCdPP&fccid=29593153878c7ce7&cmp=dbSeer&ti=Data+Scientist&vjs=3,"Profile insightsFind out how your skills align with the job descriptionSkillsDo you have experience in Scala?YesNoEducationDo you have a Master's degree?YesNo Job detailsHere’s how the job details align with your profile.Pay$110,000 - $130,000 a yearJob typeFull-timeContract Location7950 Jones Branch Drive, McLean, VA 22102 BenefitsPulled from the full job description401(k)401(k) matchingDental insuranceHealth insurancePaid time off Full job descriptionWho We Are dbSeer is a new breed of business analytics consulting firm, dedicated to helping our customers take full advantage of their data by transforming it into actionable insight. Leveraging expertise in a variety of data and analytics technologies and by employing our unique analytics framework, we promote an agile approach and project methodology that simplifies each project into a series of short, ROI-justified steps aimed at incrementally reaching the target solution. We match best-of-breed analytics technologies to the needs of our clients to provide the right solution and obtain the best results in the shortest possible time with the least cost and effort. Founded in 2013, dbSeer focuses on helping our clients solve their unique analytics, data architecture and design, and data engineering challenges. We recognize that analytics are critical to your business success when properly designed and implemented. As a strategic partner, we collaborate with you to plan, design, develop, and deploy solutions that help you transform data into insight, ultimately improving your business operations. Contributions: As a Data Scientist, you will work with our customers to create descriptive, predictive, and prescriptive models and insights to drive impacts to the organization. Work with business stakeholders, tech and data engineers to problem solve and develop modeling strategy and solutions with innovative approach. Responsibilities  Design, develop, and evaluate complex predictive models and advanced algorithms Identifies meaningful insights from large data and metadata sources Test hypotheses/models, analyze, and interpret results Develop and code moderately complex algorithms, and automated processes Use modeling and trend analysis to analyze data and provide insights Lead small projects and initiatives Manage numerous priorities using proven project management methodologies and sound development practices to ensure quality delivery. Build client trust and respect, establish client relationships, and develop rapport with client.  Qualifications  Bachelor’s or Master’s degree in Data Science, Statistics, Mathematics, Computers Science, Engineering, or degrees in similar quantitative fields  · 2-4 years of experience building, scaling, and optimizing ML systems  Strong Python programming skills Understanding of relational databases. Strong problem solving and analytical skills. Excellent communication skills ability to collaborate effectively across teams and convey technical concepts to non-technical stakeholders.  Job Types: Full-time, Contract Pay: $110,000.00 - $130,000.00 per year Benefits:  401(k) 401(k) matching Dental insurance Health insurance Paid time off  Experience level:  2 years  Ability to Relocate:  McLean, VA 22102: Relocate before starting work (Required)  Work Location: In person ",NA
1,Data Scientist,Telecom Data Scientist,"Foxhound Federal LLCMcLean, VA 22102",http://www.indeed.com/rc/clk?jk=d7fea3ae6ab493c2&bb=E5D0-e-RDhZJMYuphDBGvo5FME2hLkGq46qELN08FEN7Wve02a89o7kXrS-WoVZtJbIcFNJSFrSvQ0nslpWMAmeQAnS1BH-USAjG0z-BEiNZ13JHmGho_g%3D%3D&xkcb=SoCD67M3CNkCGdQ8MZ1pbzkdCdPP&fccid=7c60906a93c1d77e&vjs=3,"Profile insightsFind out how your skills align with the job descriptionSkillsDo you have experience in Statistics?YesNoEducationDo you have a Master's degree?YesNo Job detailsHere’s how the job details align with your profile.Job typeFull-time LocationMcLean, VA 22102 BenefitsPulled from the full job description401(k)Dental insuranceFlexible scheduleHealth insurancePaid time offVision insuranceWork from home Full job description Benefits:   401(k) Competitive salary Dental insurance Flexible schedule Health insurance Paid time off Vision insurance   Join our dynamic team at DGS, a cutting-edge data solutions company, for wireless networks, where innovation meets excellence in the realm of Radio Frequency (RF) awareness and environmental monitoring technologies. We are seeking a qualified candidate for the role of Senior System Engineer specializing in 5G wireless communication. You will play a pivotal role in the design, development, and optimization of cutting-edge 5G systems and technologies.    We are seeking a qualified Telecoms Data Scientist to play a crucial role in analyzing large datasets relating to telecommunications network performance, user behavior, and network optimization. Expertise in 5G Wireless communication is preferred.    In this role you will…   Collect, preprocess, and analyze large volumes of telecommunications data, including network logs, RF spectrum measurements, and environmental sensor data. Clean, transform, and organize raw data to prepare it for analysis, ensuring data integrity and quality. Work with simulated data and environments, as well as MATLAB tools. Conduct exploratory data analysis to uncover insights and trends related to RF spectrum utilization, network performance, and environmental factors. Develop statistical models and machine learning algorithms to extract actionable insights and optimize RF spectrum usage. Collaborate with cross-functional teams, including RF engineers, software developers, and product managers, to translate data-driven insights into innovative solutions. Design and implement algorithms for RF interference detection, mitigation, and localization, contributing to the enhancement of RF environmental awareness capabilities. Stay abreast of the latest advancements in telecommunications, RF spectrum management, and data science techniques, incorporating new methodologies and technologies into our analytical workflows. The ideal candidate would possess…   Master’s or Doctorate degree in Computer Science, Data Science Electrical Engineering, Statistics, or a related field. Proven experience as a Data Scientist or similar role, with a focus on analyzing telecommunications data. Strong background in RF communication principles, wireless networking technologies, and RF spectrum management. Deep understanding of working with decoded LTE/5G Data. Expertise in data analysis, statistical modeling, and machine learning techniques, with proficiency in Python, R, or other programming languages. Experience working with large-scale datasets and distributed computing frameworks. Familiarity with telecommunications network performance measurement tools and protocols. Excellent analytical, problem-solving, and critical-thinking skills. Strong communication and collaboration abilities, with the ability to present complex findings clearly and concisely. Ability to thrive in a fast-paced, innovative environment and manage multiple projects simultaneously.   Foxhound Federal, LLC is an equal opportunity and affirmative action employer. Foxhound Federal is committed to administering all employment and personnel actions on the basis of merit and free of discrimination based on race, color, religion, sex, sexual orientation, gender identity, national origin, protected veteran status, or status as an individual with a disability. Consistent with this commitment, we are dedicated to the employment and advancement of qualified minorities, women, individuals with disabilities, protected veterans, persons of all ethnic backgrounds and religions according to their abilities.    Flexible work from home options available.  ",NA
2,Data Scientist,"Data Scientist, Industrialized Workflows","RecursionSalt Lake City, UT 84108 (East Bench area)",http://www.indeed.com/rc/clk?jk=0f9f74e479f40791&bb=E5D0-e-RDhZJMYuphDBGvoSiD-94V78gTdcIjn7Kh6B4Z02U4FU3cl2TdqIHvAv7FBH3-4r2oj_8RuL1fAvj273NaOdMT1O45bxiqr4N7z1ZTSuXP_Loqg%3D%3D&xkcb=SoA367M3CNkCGdQ8MZ1obzkdCdPP&fccid=877d7de2a3934dfe&vjs=3,"Profile insightsFind out how your skills align with the job descriptionSkillsDo you have experience in Statistics?YesNo Location630 Komas Drive, Salt Lake City, UT 84108 Full job description  Your work will change lives. Including your own.    The Impact You'll Make  With treatments for hundreds of diseases in our sights, we've built a data science team with domain expertise in computer science, bioinformatics, physics, biology, mathematics, applied statistics, and more. We work side-by-side with biologists, oncologists, chemists, software engineers, and many others; together, we develop the tools and methods to turn our experimental data into treatments for pathologies that affect the lives of countless individuals. As a data scientist supporting the development of our industrialized workflows, you'll work with a highly dynamic team that is focused on improving how we move from ideation through to advanced candidate drugs in a way that accelerates decision-making and automates as much as possible to scale the impact that we can have.  You'll have access to unbelievable scales of data: we currently run up to 2.2 million experiments each week, our ground-breaking Phenom-1 foundation model, trained on > 1 billion in-house images, and our maps of biology and chemistry that contain > 5 trillion relationships across multiple biological and chemical contexts.  In this role, you will leverage this data as you:  Develop methods, metrics, benchmarks, and models to help drive drug discovery in a standardized way. Convert exploratory analysis into production-quality functions that can be incorporated into in-house Python packages and that support at-scale generation of data packages to accelerate decisions on passing programs through internal stage gates. Create and analyze enormous sets of connected data for a variety of programs to learn how best to advance drug discovery in an industrialized way Collaborate with engineering teams to mature your models and analyses and put them into productionized flows Deliver quickly and iteratively, both supporting in-flight programs and building improvements for the long-term in short-lived, agile workstreams Learn to leverage new code packages and data science techniques as needed  Location:  Making Salt Lake City your home base is ideal, however, we will consider on-site work in our Toronto, Ontario offices as well.  The Team You'll Join  We are an application-oriented group whose goal is to discover drugs at scale, using the toolkit of computational science in collaboration with our counterparts in other engineering (software and data engineering, laboratory automation), scientific (biology, chemistry, clinical science), and operational (laboratory operations, regulatory affairs) disciplines. We are value-driving - data science at Recursion is not just an accelerating function; it is a core part of our value proposition. As data scientists, we are responsible for showing up as leaders and visionaries, helping to shape how Recursion delivers on our mission. We work on what matters and deliver in timescales of weeks not quarters. We focus on the impact that we are trying to make and the ""why"" of what we are trying to deliver and are resilient if the ""how"" of what we are doing needs to change.  The Experience You'll Need  2+ years practical experience applying probability, statistics, and machine learning to real-world datasets in service of academic or business applications and recommendations.  Strong preference for experience in the field of biosciences (particularly pharmaceuticals) or working on projects that require regular cross-disciplinary collaboration.  Experience working within a fast-paced interdisciplinary team to solve business-relevant problems and communicating complex concepts and methods to audiences with diverse technical backgrounds. High fluency with the Python data stack (numpy, pandas, scikit-learn, etc). Experience in collaborative data product development and peer code review, including version control tools like git. Experience developing, releasing, and maintaining data products in a continuous-use production environment. Nice to have: experience in creating compelling visualizations of high-dimensional data that enable clear decision-making and interpretation, prompt engineering for LLMs, cheminformatics, OR analysis of RNA sequencing data.  How You'll be Supported  You will be assigned a peer trail guide to support you as you onboard and get familiar with Recursion systems Receive real-time feedback on code quality and best practices from a team of peer experts Ability to participate and learn from your colleagues in our regular all-hands, journal club & tech talks for Data Science Option to attend conferences to learn more from colleagues, networks, and more to better your skillset  #LI-EP1   The Values That We Hope You Share:  We Care: We care about our drug candidates, our Recursionauts, their families, each other, our communities, the patients we aim to serve and their loved ones. We also care about our work. We Learn: Learning from the diverse perspectives of our fellow Recursionauts, and from failure, is an essential part of how we make progress. We Deliver: We are unapologetic that our expectations for delivery are extraordinarily high. There is urgency to our existence: we sprint at maximum engagement, making time and space to recover. Act Boldly with Integrity: No company changes the world or reinvents an industry without being bold. It must be balanced; not by timidity, but by doing the right thing even when no one is looking. We are One Recursion: We operate with a 'company first, team second' mentality. Our success comes from working as one interdisciplinary team.  Recursion spends time and energy connecting every aspect of work to these values. They aren't static, but regularly discussed and questioned because we make decisions rooted in those values in our day-to-day work. You can read more about our values and how we live them every day here.  More About Recursion  Recursion is a clinical stage TechBio company leading the space by decoding biology to industrialize drug discovery. Enabling its mission is the Recursion OS, a platform built across diverse technologies that continuously expands one of the world's largest proprietary biological and chemical datasets. Recursion leverages sophisticated machine-learning algorithms to distill from its dataset a collection of trillions of searchable relationships across biology and chemistry unconstrained by human bias. By commanding massive experimental scale — up to millions of wet lab experiments weekly — and massive computational scale — owning and operating one of the most powerful supercomputers in the world, Recursion is uniting technology, biology and chemistry to advance the future of medicine.  Recursion is headquartered in Salt Lake City, where it is a founding member of BioHive, the Utah life sciences industry collective. Recursion also has offices in London, Toronto, Montreal and the San Francisco Bay Area. Learn more at www.Recursion.com, or connect on X (formerly Twitter) and LinkedIn.  Recursion is an Equal Opportunity Employer that values diversity and inclusion. All qualified applicants will receive consideration for employment without regard to race, color, religion, sex, sexual orientation, gender identity, national origin, age, disability, veteran status, or any other characteristic protected under applicable federal, state, local, or provincial human rights legislation.   ",NA
3,Data Scientist,Machine Learning Quality Engineer,"ServiceNowSanta Clara, CA 95054",http://www.indeed.com/rc/clk?jk=a66a845bd7ea0174&bb=E5D0-e-RDhZJMYuphDBGvmJjk6JeDhEztZYQMfpHWux265ZbQVoet4r8ZUvC9oiBMbQfct9R-K43QSHRMn0ajyeTx2sHsXifaEsOuY43mJAz2QGNPpM1IA%3D%3D&xkcb=SoC567M3CNkCGdQ8MZ1vbzkdCdPP&fccid=7442885bc0fa7c14&vjs=3,"Profile insightsFind out how your skills align with the job descriptionSkillsDo you have experience in UNIX?YesNoEducationDo you have a Master's degree?YesNo Location2225 Lawson Ln, Santa Clara, CA 95054 BenefitsPulled from the full job description401(k) matchingEmployee stock purchase planFamily leaveFlexible spending accountHealth insurance Full job description Company Description  At ServiceNow, our technology makes the world work for everyone, and our people make it possible. We move fast because the world can’t wait, and we innovate in ways no one else can for our customers and communities. By joining ServiceNow, you are part of an ambitious team of change makers who have a restless curiosity and a drive for ingenuity. We know that your best work happens when you live your best life and share your unique talents, so we do everything we can to make that possible. We dream big together, supporting each other to make our individual and collective dreams come true. The future is ours, and it starts with you. With more than 7,700+ customers, we serve approximately 85% of the Fortune 500®, and we're proud to be one of FORTUNE 100 Best Companies to Work For® and World's Most Admired Companies™. Learn more on Life at Now blog and hear from our employees about their experiences working at ServiceNow. Unsure if you meet all the qualifications of a job description but are deeply excited about the role? We still encourage you to apply! At ServiceNow, we are committed to creating an inclusive environment where all voices are heard, valued, and respected. We welcome all candidates, including individuals from non-traditional, varied backgrounds, that might not come from a typical path connected to this role. We believe skills and experience are transferrable, and the desire to dream big makes for great candidates. Job Description   Experience in quality assurance and/or application development Strong test automation skills in Java / Python Hands-on experience testing large-scale, production systems in Python or Java Excellent communication, collaboration, reporting, analytical and problem-solving skills Ability to take a project from scoping the requirements and building the test cases Maintain existing automation test frameworks Familiarity with testing AI/ML models and evaluation of the model quality Ability to analyze results from the test set and create defects based on result patterns Work with developers to design specific testing strategies for features being developed and automate them Create comprehensive test plans; execute and automate them Support engineering organizations in troubleshooting or addressing issues with applications and dev/test environments    Qualifications   Bachelors in Computer Science / Computer Engineering or related subjects with 3 years of work experience Masters in Computer Science / Computer Engineering or related subjects with 2 years of work experience 2+ years of experience with technologies relevant to SN and coding skills with high-quality results. Experience working within different automated testing frameworks, including Java, JUnit, Python, Selenium, TestNG and other open-source projects. Experience with the agile methodology for software development teams. Ability to understand several testing techniques (e.g. performance, unit, integration, automated), their strengths and weakness, and ability to use them to best effect - including tracking and addressing of any discovered issues. Ability to use tools (such as IDE, debugger, build tools, source control, ServiceNow instances, profilers, system administration/Unix tools) to assist with daily tasks For positions in the Bay Area, we offer a base pay of $121,600 - $188,400, plus equity (when applicable), variable/incentive compensation and benefits. Sales positions generally offer a competitive On Target Earnings (OTE) incentive compensation structure. Please note that the base pay shown is a guideline, and individual total compensation will vary based on factors such as qualifications, skill level, competencies and work location. We also offer health plans, including flexible spending accounts, a 401(k) Plan with company match, ESPP, matching donations, a flexible time away plan and family leave programs (subject to eligibility requirements). Compensation is based on the geographic location in which the role is located, and is subject to change based on work location.    Additional Information  ServiceNow is an Equal Employment Opportunity Employer. All qualified applicants will receive consideration for employment without regard to race, color, creed, religion, sex, sexual orientation, national origin or nationality, ancestry, age, disability, gender identity or expression, marital status, veteran status or any other category protected by law. At ServiceNow, we lead with flexibility and trust in our distributed world of work. Click here to learn about our work personas: flexible, remote and required-in-office. If you require a reasonable accommodation to complete any part of the application process, or are limited in the ability or unable to access or use this online application process and need an alternative method for applying, you may contact us at talent.acquisition@servicenow.com for assistance. For positions requiring access to technical data subject to export control regulations, including Export Administration Regulations (EAR), ServiceNow may have to obtain export licensing approval from the U.S. Government for certain individuals. All employment is contingent upon ServiceNow obtaining any export license or other approval that may be required by the U.S. Government. Please Note: Fraudulent job postings/job scams are increasingly common. Click here to learn what to watch out for and how to protect yourself. All genuine ServiceNow job postings can be found through the ServiceNow Careers site.   From Fortune. © 2022 Fortune Media IP Limited All rights reserved. Used under license. Fortune and Fortune Media IP Limited are not affiliated with, and do not endorse products or services of, ServiceNow.  ",NA
4,Data Scientist,Junior Data Scientist,"Forge Forward, Inc.Hybrid remote in Lexington Park, MD",http://www.indeed.com/rc/clk?jk=d27a0b9c5373e0ca&bb=E5D0-e-RDhZJMYuphDBGvlwd5-GndPObvK1sVgscPuWx4_YJV7xj0RcAMjXXnrHXvHE1fL3ROi8WH-AsKzql0cs2YyKHF8--qcZm0rBDMNffbxezoQCFgQ%3D%3D&xkcb=SoAk67M3CNkCGdQ8MZ1sbzkdCdPP&fccid=339feaa66eeccb5d&cmp=Forge-Forward%2C-Inc.&ti=Junior+Data+Scientist&vjs=3,"Profile insightsFind out how your skills align with the job descriptionSkillsDo you have experience in Project management?YesNoEducationDo you have a Bachelor's degree?YesNo Job detailsHere’s how the job details align with your profile.Pay$50,000 - $70,000 a yearJob typeFull-timeShift and schedule8 hour shiftMonday to Friday LocationLexington Park, MD BenefitsPulled from the full job description401(k)401(k) matchingDental insuranceEmployee assistance programFlexible spending accountHealth insuranceLife insuranceShow morechevron down Full job descriptionForge Forward is looking for a Junior Data Scientist to support a client's digital transformation effort in Lexington Park, MD. Position will be required to be on-site 4 days a week. Only US citizens can be considered as this position will require a security clearance. Applies change management methodologies or techniques to identify challenges, assesses impact to the organization, and develops courses of action to address the issue. Supports organizational assessment and transformation, process analysis and improvement, facilitation of small group sessions, and development of key communications. Requirements:-0-2 years of experiences in areas of general project management support, analysis, change management, and facilitation.- Bachelor’s degree in Business, Management or any analytical discipline.-US citizen with the ability to obtain a security clearance. Functional Skills and Responsibilities:-Develops and facilitates client sessions and data gathering exercises.-Integrates ideas and capabilities within client/corporate tools to improve processes and execution.-Collaborates with team members to collect and assess information.-Works with a team of analysts and other associates to process information.-Creates presentations and reports based on recommendations and findings. Forge Forward, Inc. is an equal opportunity/affirmative action employer. All qualified applicants will receive consideration for employment without regard to sex, gender identity, sexual orientation, race, color, religion, national origin, disability, protected Veteran status, age, or any other characteristic protected by law. Job Type: Full-time Pay: $50,000.00 - $70,000.00 per year Benefits:  401(k) 401(k) matching Dental insurance Employee assistance program Flexible spending account Health insurance Life insurance Paid time off Professional development assistance Referral program Tuition reimbursement Vision insurance  Compensation package:  Yearly pay  Experience level:  1 year 2 years Under 1 year  Schedule:  8 hour shift Monday to Friday  Application Question(s):  This position will require a security clearance. To obtain a security clearance you must be a US citizen. Are you a US citizen?  Work Location: Hybrid remote in Lexington Park, MD ",NA
