Id,profile,titles,companies,links,data,date_listed
7,Data Scientist,"AIML - Machine Learning Researcher, MLR","AppleCupertino, CA",http://www.indeed.com/rc/clk?jk=05b55520f7eb2d0b&bb=AbDN_Sau9azpIrnPUsr1yaufNDWaWo5iMRX0F4TRcIWpmxtmTQVF-SUwp3QmzDAPyUXOCXLMrMjVv33a-VxE_xUETMFGCFUp9r-wMAKiPY8%3D&xkcb=SoDN67M3CNkeuKxylh0MbzkdCdPP&fccid=c1099851e9794854&vjs=3,"Profile insightsFind out how your skills align with the job descriptionSkillsDo you have experience in Statistics?YesNoEducationDo you have a Doctoral degree?YesNo Job detailsHere’s how the job details align with your profile.Pay$170,700 - $300,200 a yearJob typeFull-time LocationCupertino, CA BenefitsPulled from the full job descriptionDental insuranceEmployee stock purchase planHealth insuranceRSURetirement plan Full job description Summary   Posted: Jan 30, 2024    Weekly Hours: 40   Role Number:200516560   Play a part in building the next revolution of machine learning technology. We're looking for passionate mid-level and senior researchers to work on ambitious curiosity driven long-term research projects that will impact the future of Apple, and our products. In this role, you'll have the opportunity to work on innovative foundational research in machine learning. As a member of the team, you will be inspired by a diversity of challenging problems, collaborate with world-class machine learning engineers and researchers to impact the future of Apple products, and publish some of your results in high-quality scientific venues.    Key Qualifications    Demonstrated expertise in machine learning research.  Publication record in top machine learning, vision and NLP conferences (e.g., NeurIPS, ICML, ICLR, AAAI, CVPR, ICCV, ECCV, ACL, EMNLP, etc).  Hands-on experience working with deep learning toolkits such as PyTorch.  Strong mathematical skills in linear algebra and statistics.  Ability to formulate a research problem, design, experiment, implement and communicate solutions.  Ability to work in a diverse collaborative environment. Experience with generative models (energy based models, diffusion models, variational methods, autoregressive models) for vision, speech and language, large language models training, reinforcement learning etc is desirable      Description   In this position you will conduct cutting edge research in Machine Learning in collaboration with your colleagues in MLR. You will advance the state of the art in diverse topics such as generative models, language modeling, reinforcement learning, etc, by developing new techniques and demonstrating them on different domains such as speech, vision and language. An integral part of the job involves publishing of the results to top level ML conferences, and participating in the research community through conferences, workshops etc. You will also have the opportunity to collaborate with broader teams across Apple in the use of the latest ML techniques.    Education & Experience   PhD in Computer Science, or related technical field, with a well-established track record in publishing in top Machine Learning conferences like NeurIPS, ICML, ICLR, etc.    Additional Requirements   Pay & Benefits      At Apple, base pay is one part of our total compensation package and is determined within a range. This provides the opportunity to progress as you grow and develop within a role. The base pay range for this role is between $170,700.00 and $300,200.00, and your base pay will depend on your skills, qualifications, experience, and location.  Apple employees also have the opportunity to become an Apple shareholder through participation in Apple’s discretionary employee stock programs. Apple employees are eligible for discretionary restricted stock unit awards, and can purchase Apple stock at a discount if voluntarily participating in Apple’s Employee Stock Purchase Plan. You’ll also receive benefits including: Comprehensive medical and dental coverage, retirement benefits, a range of discounted products and free services, and for formal education related to advancing your career at Apple, reimbursement for certain educational expenses - including tuition. Additionally, this role might be eligible for discretionary bonuses or commission payments as well as relocation. Learn more about Apple Benefits.  Note: Apple benefit, compensation and employee stock programs are subject to eligibility requirements and other terms of the applicable plan or program.  Apple is an equal opportunity employer that is committed to inclusion and diversity. We take affirmative action to ensure equal opportunity for all applicants without regard to race, color, religion, sex, sexual orientation, gender identity, national origin, disability, Veteran status, or other legally protected characteristics.    ",NA
8,Data Scientist,Computer Vision and Machine Learning Engineer - Apple Vision Pro,"AppleSeattle, WA",http://www.indeed.com/rc/clk?jk=876ce683bf41d1d6&bb=AbDN_Sau9azpIrnPUsr1yfwQ5pFGx4M6hwYupkmIEwpxDPm2G3XnrH9mI1GKcZb2BLkOAAr-EXvAKWJueVaLQouR-VYO8PjGnzW-xHWSV-s%3D&xkcb=SoAk67M3CNkeuKxylh0DbzkdCdPP&fccid=c1099851e9794854&vjs=3,"Profile insightsFind out how your skills align with the job descriptionSkillsDo you have experience in Python?YesNoEducationDo you have a Master's degree?YesNo LocationSeattle, WA BenefitsPulled from the full job descriptionDental insuranceEmployee stock purchase planHealth insuranceRSURetirement plan Full job description Summary   Posted: Mar 1, 2024    Role Number:200540711   Apple is where individual imaginations gather together, committing to the values that lead to great work. Every new product we build, service we create, or Apple Store experience we deliver is the result of us making each other’s ideas stronger. That happens because every one of us shares a belief that we can make something wonderful and share it with the world, changing lives for the better. It’s the diversity of our people and their thinking that inspires the innovation that runs through everything we do. When we bring everybody in, we can do the best work of our lives. Here, you’ll do more than join something - you’ll add something. Apple Vision Pro is a revolutionary spatial computer that seamlessly blends digital content with your physical space. It will allow us to do the things we love in ways never before possible - all while staying connected to the people around us. In this position, you will join a team of computer vision and machine learning researchers and engineers to discover and build solutions to previously-unsolved challenges and push the state of the art. We are looking for a self-driven and motivated computer vision/machine learning engineer, experienced in applying machine learning to mobile computer vision algorithms. As a member of a fast-paced prototyping team, you have the unique and rewarding opportunity to shape upcoming products that will delight and inspire millions of people every day.    Key Qualifications    Track record of successfully building and shipping products.  Strong experience in mobile machine learning and pipelining.  Strong experience in 3D geometry and computer vision.  Experience in 3D Reconstruction is a plus.  Experience in modern Novel View Synthesis methods, suchas NeRF, Gaussian Splatting, etc., is a plus  Excellent coding skills.  Excellent communication and collaboration skills.  Excellent problem solving and analytical thinking skills.  Creativity and curiosity for solving highly complex problems.  Experience in Python and C++ Experience with GPU programming or Metal is a plus.      Description   You’ll be working in a team of computer vision and machine learning researchers and engineers to prototype and ship world class algorithms that pushes the state of the art. Your job responsibilities will include: Inventing and implementing state of the art computer vision algorithms to solve cutting edge problems. Designing such algorithms to work reliably and efficiently on mobile devices. Collaborating with other teams in software and hardware to ensure the full pipeline runs efficiently and utilizes Apple hardware effectively Cooperating with your teammembers to prepare presentations, papers, and talks to explain your inventions.    Education & Experience   MS or PhD in computer vision, machine learning, computer science, computer engineering or relevant industry experience with a track record of successful projects.    Additional Requirements   Pay & Benefits      At Apple, base pay is one part of our total compensation package and is determined within a range. This provides the opportunity to progress as you grow and develop within a role. The base pay range for this role is between $131,500.00 and $243,300.00, and your base pay will depend on your skills, qualifications, experience, and location.  Apple employees also have the opportunity to become an Apple shareholder through participation in Apple’s discretionary employee stock programs. Apple employees are eligible for discretionary restricted stock unit awards, and can purchase Apple stock at a discount if voluntarily participating in Apple’s Employee Stock Purchase Plan. You’ll also receive benefits including: Comprehensive medical and dental coverage, retirement benefits, a range of discounted products and free services, and for formal education related to advancing your career at Apple, reimbursement for certain educational expenses - including tuition. Additionally, this role might be eligible for discretionary bonuses or commission payments as well as relocation. Learn more about Apple Benefits.  Note: Apple benefit, compensation and employee stock programs are subject to eligibility requirements and other terms of the applicable plan or program.  Apple is an equal opportunity employer that is committed to inclusion and diversity. We take affirmative action to ensure equal opportunity for all applicants without regard to race, color, religion, sex, sexual orientation, gender identity, national origin, disability, Veteran status, or other legally protected characteristics.    ",NA
9,Data Scientist,Machine Learning Software Engineer,"AppleSunnyvale, CA",http://www.indeed.com/rc/clk?jk=07574dc3993c0377&bb=AbDN_Sau9azpIrnPUsr1yUvBC6Z9SWDnh2tKQoHnr1CcVKvOm_LfhyyWIj3ntzbSc7WQQDXQvoIr30HjBI0J2GgmL5R7_jVPpFPOJL2sorQ%3D&xkcb=SoCQ67M3CNkeuKxylh0CbzkdCdPP&fccid=c1099851e9794854&vjs=3,"Profile insightsFind out how your skills align with the job descriptionSkillsDo you have experience in Training & development?YesNoEducationDo you have a Bachelor's degree?YesNo LocationSunnyvale, CA BenefitsPulled from the full job descriptionDental insuranceEmployee stock purchase planHealth insuranceRSURetirement plan Full job description Summary   Posted: Mar 1, 2024    Role Number:200540712   The Video Computer Vision org is a centralized applied research and engineering organization responsible for developing real-time on-device Computer Vision and Machine Perception technologies across Apple products. We balance research and product to deliver Apple quality, state-of-the-art experiences, innovating through the full stack, and partnering with HW, SW and ML teams to influence the sensor and silicon roadmap that brings our vision to life. This role is highly multi-functional and you will work very closely with various highly skilled machine learning and software development teams developing groundbreaking algorithms. Are you ready to work on what's next at Apple?    Key Qualifications    Experience in biometrics/face tracking/gaze tracking (preferred)  Minimum 3 years of professional software development experience in modern C++ & Python (Objective C/C++, Swift is a plus).  Familiar with algorithm implementation and optimization with platform constraints.  Experience in computer vision / machine learning product development and delivery. Experience in working with sophisticated software stacks. Creativity and curiosity for solving highly sophisticated problems.      Description   We are looking for a Machine Learning Software Engineer to join the team of highly accomplished and deeply technical scientists. We work to design and build machine learning systems, implement and integrate new algorithms, and optimize the system to improve performance. This role will be able to contribute to impactful projects at Apple, and use your skills to transfer ideas into solutions for some of the most complicated technical problems in the next generation of products that will delight millions of people.    Education & Experience   BS and a minimum of 3 years relevant industry experience    Additional Requirements   Pay & Benefits      At Apple, base pay is one part of our total compensation package and is determined within a range. This provides the opportunity to progress as you grow and develop within a role. The base pay range for this role is between $138,900.00 and $256,500.00, and your base pay will depend on your skills, qualifications, experience, and location.  Apple employees also have the opportunity to become an Apple shareholder through participation in Apple’s discretionary employee stock programs. Apple employees are eligible for discretionary restricted stock unit awards, and can purchase Apple stock at a discount if voluntarily participating in Apple’s Employee Stock Purchase Plan. You’ll also receive benefits including: Comprehensive medical and dental coverage, retirement benefits, a range of discounted products and free services, and for formal education related to advancing your career at Apple, reimbursement for certain educational expenses - including tuition. Additionally, this role might be eligible for discretionary bonuses or commission payments as well as relocation. Learn more about Apple Benefits.  Note: Apple benefit, compensation and employee stock programs are subject to eligibility requirements and other terms of the applicable plan or program.  Apple is an equal opportunity employer that is committed to inclusion and diversity. We take affirmative action to ensure equal opportunity for all applicants without regard to race, color, religion, sex, sexual orientation, gender identity, national origin, disability, Veteran status, or other legally protected characteristics.    ",NA
10,Data Scientist,Data Analyst / Public Health SME,General Dynamics Information TechnologyRemote,http://www.indeed.com/rc/clk?jk=96f36bc0f484008f&bb=AbDN_Sau9azpIrnPUsr1yV0fwQxUB_X_Xih96UVN2--G2yptid26CpAqqctVsdfYs8LNV6Bm6tmrcW3nH5CbEj-AEZrP6Q1ZsdJ17Q3Q9GM%3D&xkcb=SoDl67M3CNkev1Rylh0LbzkdCdPP&fccid=11caadcdc98800d4&vjs=3,"Profile insightsFind out how your skills align with the job descriptionSkillsDo you have experience in Tableau?YesNoEducationDo you have a Master's degree?YesNo Job detailsHere’s how the job details align with your profile.Pay$52,000 - $78,000 a yearJob typeFull-time LocationRemote BenefitsPulled from the full job description401(k)401(k) matchingAD&D insuranceDisability insuranceFamily leaveHealth insuranceHealth savings accountShow morechevron down Full job description    Type of Requisition:   Regular       Clearance Level Must Currently Possess:   None       Clearance Level Must Be Able to Obtain:   None       Suitability:        Public Trust/Other Required:        Job Family:   Data Analysis       Job Qualifications:       Skills:   Data Analysis, Data Analytics, Datasets, Statistics      Certifications:       Experience:   3 + years of related experience      US Citizenship Required:   No       Job Description:       GDIT is looking for a Data Scientist with deep data analytics skills. The candidate needs to be an advanced practitioner of SQL, R, Python and be familiar with working with data in an Azure Cloud environment using DataBricks and other cloud analytics tools.      Supporting CDC in a fast-paced environment that requires the ability to work with big data sets and turn complex analysis around in a few days. There may be opportunities to support MMWR and other publications.        Responsibilities:     The candidate will provide high-level expertise to develop study questions and designs; conduct analyses; and interpret findings based on electronic case reporting data and pharmacy, hospital, and healthcare claims data.  Support use of SAS Viya in quality evaluation  Experience in Iqvia, and other public health data sources.  Co-author and write papers for publications in peer-review journals and reports; present papers/research/findings to the scientific community at professional meetings and conferences.  Maintain requisite knowledge for managing and analyzing large data sets using Python, SAS, SQL, or R.  Trains/demonstrates new analytics tools and software languages for DHIS/PEB staff. Perform work for review in timely intervals as defined by Health Scientist Coordinator.  Reviews deliverables to ensure time frames and quality standards are met, and then submits deliverables within established time frames.  Support CDC clearance process for scientific products, which includes reviewing materials produced by others.  Draft data analysis plans for ad hoc or standard reports.  Develop and document Python, SAS, R, or SQL programs, views, and databases.  Conduct exploratory or study-specific analyses.  Verify results and validate with other known information sources.  Summarize and visualize results (for example, develop graphs for dashboards showing data metrics).  Draft final reports, methodological white papers, or articles for publication.  Track technical assistance being provided to ensure queries are answered promptly and consistently.  Produce data extracts and cleaning scripts.  Develop data management and analysis materials, including graphics to convey analyses.  Publish analysis and QC scripts to central repository or shared space like GitHub for use by others within PEB and across the agency upon review and acceptance by CDC.  Lead the analysis and writing for at least one peer review publication  Oversee the development of presentations based on his/her analyses and/or the analyses of staff/contractors to be shared with internal partners, Community of Practice members, and other partners.  Oversee the development of data visualizations and dashboard showcasing the portfolio of CDH’s managed data sources for sharing with internal and external audiences. The candidate will provide high-level expertise to develop study questions and designs; conduct analyses; and interpret findings based on electronic case reporting data and pharmacy, hospital, and healthcare claims data.  Co-author and write papers for publications in peer-review journals and reports; present papers/research/findings to the scientific community at professional meetings and conferences.  Maintain requisite knowledge for managing and analyzing large data sets using Python, SAS, SQL, or R.  Trains/demonstrates new analytics tools and software languages for DHIS/PEB staff. Perform work for review in timely intervals as defined by Health Scientist Coordinator.  Reviews deliverables to ensure time frames and quality standards are met, and then submits deliverables within established time frames.  Support CDC clearance process for scientific products, which includes reviewing materials produced by others       WHAT YOU’LL NEED:     Bachelors Science in Computer Science or related field, or Masters in Public Health  4 or more Years of data analysis experience, with emphasis on Big data  3 Years of specific data analysis tools: Python, R, SAS, PySpark, Tableau Server, PostgreSQL, SQL, Django, ArcGIS,       Qualifications:     Mid level understanding of data analysis including the use of SAS, R, SQL and Python for developing database views and programs  Experience with large ‘big data’ datasets  Ability to draft data analysis plans  Self-sufficient (needs little supervision)  Sound interpersonal communication, telephone, email and business etiquette  Strong attention to detail and organizational skills  Experience in facilitating quick turn-around for complex documents  Experience in assisting in the preparation of documents for public audiences  Experience in the use of MS Teams and Microsoft Office software (i.e., Word; Excel; PowerPoint; Outlook)  Must have the ability to obtain a National Agency Check with Inquiries (NACI) clearance  Other valuable experience: 'BIG DATA'; Data and Systems Analysis, Strong R and Python Experience; Data ETL experience; Workflow/Process Redesign; Automating Data Pipelines; Mapping SQL Database Tables; Statistical/Predictive Modeling       Desired Skills and Experience:     Previous CDC and or public health experience highly desirable  Superior multi-tasking and organization skills. Must manage multiple simultaneous projects and prioritize assignments and tasks accordingly, remaining flexible to changing priorities and new initiatives.       Attributes for Success:     Demonstrated proactive approaches to problem solving with strong decision-making capabilities  Forward looking thinker, who actively seeks opportunities and proposes solutions  Analyze organizational goals and objectives, operating environment and business processes to determine most efficient methods of accomplishing work       LOCATION: Remote        CLEARANCE:     Ability to obtain a Public Trust: candidate must pass a public trust background investigation and meet the residency requirement for having resided in the US for at least (3) three out of the last (5) five years.      GDIT IS YOUR PLACE:      Full-flex work week to own your priorities at work and at home 401K with company match Comprehensive health and wellness packages Internal mobility team dedicated to helping you own your career Professional growth opportunities including paid education and certifications Cutting-edge technology you can learn from Rest and recharge with paid vacation and holidays    The likely salary range for this position is $52,000 - $78,000. This is not, however, a guarantee of compensation or salary. Rather, salary will be set based on experience, geographic location and possibly contractual requirements and could fall outside of this range.       Scheduled Weekly Hours:   40       Travel Required:   Less than 10%       Telecommuting Options:   Remote       Work Location:   Any Location / Remote       Additional Work Locations:        Total Rewards at GDIT:   Our benefits package for all US-based employees includes a variety of medical plan options, some with Health Savings Accounts, dental plan options, a vision plan, and a 401(k) plan offering the ability to contribute both pre and post-tax dollars up to the IRS annual limits and receive a company match. To encourage work/life balance, GDIT offers employees full flex work weeks where possible and a variety of paid time off plans, including vacation, sick and personal time, holidays, paid parental, military, bereavement and jury duty leave. GDIT typically provides new employees with 15 days of paid leave per calendar year to be used for vacations, personal business, and illness and an additional 10 paid holidays per year. Paid leave and paid holidays are prorated based on the employee’s date of hire. The GDIT Paid Family Leave program provides a total of up to 160 hours of paid leave in a rolling 12 month period for eligible employees. To ensure our employees are able to protect their income, other offerings such as short and long-term disability benefits, life, accidental death and dismemberment, personal accident, critical illness and business travel and accident insurance are provided or available. We regularly review our Total Rewards package to ensure our offerings are competitive and reflect what our employees have told us they value most.   We are GDIT. A global technology and professional services company that delivers consulting, technology and mission services to every major agency across the U.S. government, defense and intelligence community. Our 30,000 experts extract the power of technology to create immediate value and deliver solutions at the edge of innovation. We operate across 30 countries worldwide, offering leading capabilities in digital modernization, AI/ML, Cloud, Cyber and application development. Together with our clients, we strive to create a safer, smarter world by harnessing the power of deep expertise and advanced technology.   We connect people with the most impactful client missions, creating an unparalleled work experience that allows them to see their impact every day. We create opportunities for our people to lead and learn simultaneously. From securing our nation’s most sensitive systems, to enabling digital transformation and cloud adoption, our people are the ones who make change real.   GDIT is an Equal Opportunity/Affirmative Action employer. All qualified applicants will receive consideration for employment without regard to race, color, religion, sex, sexual orientation, gender identity, national origin, disability, or veteran status, or any other protected class.  ",NA
