Id,profile,titles,companies,links,data,date_listed
10,Data Scientist,Data Scientist (TS/SCI CI Poly) (3453),"SMXHybrid remote in College Park, MD",http://www.indeed.com/rc/clk?jk=4b95e91b93f0a35f&bb=E5D0-e-RDhZJMYuphDBGvnE1Mku5-H-fWWBA97bvo7mMNF9BvyozOZWCFpulG7_ozOKDdT0cB2Gg-5u4ehlWGfuqas0n5Em7i9GTP9UNoSIlZanIYsIL-w%3D%3D&xkcb=SoBN67M3CNkCGdQ8MZ15bzkdCdPP&fccid=f65dc27fae2e9bf3&vjs=3,"Profile insightsFind out how your skills align with the job descriptionSkillsDo you have experience in Model training?YesNoEducationDo you have a Bachelor's degree?YesNo Job detailsHere’s how the job details align with your profile.Job typeFull-time LocationCollege Park, MD Full job description SMX is looking for a Data Scientist. If you are dedicated to fostering a positive company culture and interested in shaping and growing our communications capabilities, SMX is an excellent place to grow your career. This is a role that will have to report to the customer's site. This person will support DIA and will need to report to their facility. This is a full-time position with on-site work performed at a client's office 3 days/week located in Washington, D.C. or Reston, VA or College Park, MD with possibility for some flexibility to work remote.  Essential Duties and Responsibilities:    Create and write technical data design documents and participate in technical design discussions that transform operational requirements into data driven solutions Use your firm understanding of data model training and prediction in order to develop data models and analytical dashboards Formulate and complete end-to-end data models that include data gathering, analysis, modeling, and ongoing scaled deliverables and presentations Structure/preprocess datasets to find usable information and to prepare for modeling Review and collaborate on recommendations and designs with other subject matter experts Develop solutions, actions items and issues, and remain accountable for their completion Work in an agile environment to continuously deliver high outputs Have a high attention to detail, working closely with plans, operations and technical stakeholders to drive measurable results Produce high-quality, well-written technical documentation Work effectively within a delivery-centric, multi-functional team Collaborate with cross-functional stakeholders to understand their operational need Provide transparent and regular status updates in requested format Work in a fast-paced Agile environment with fluid requirements and changing priorities     Required Skills/Experience:  Active TS/SCI CI Poly clearance This is a full-time position with on-site work performed 3 days/week at a client's office located in Washington, D.C. or Reston, VA or College Park, MD with possibility for some flexibility to work remote. 3+ years of technical experience Excellent written and verbal communication skills to both technical and non-technical audiences for collaborating with team members and customers.  Desired Skills/Experience:  Bachelor's degree in a technical field preferred- or equivalent years of experience and certifications Knowledge of cloud services/tools   **This position requires three days a week on site at customer location in Washington, DC or Reston, Virginia or College Park, MD. The rest of the week can be remote (there is some flexibility) **    #cjpost  #LI-onsite  #LI-hybrid     At SMX®, we are a team of technical and domain experts dedicated to enabling your mission. From priority national security initiatives for the DoD to highly assured and compliant solutions for healthcare, we understand that digital transformation is key to your future success.  We share your vision for the future and strive to accelerate your impact on the world. We bring both cutting edge technology and an expansive view of what's possible to every engagement. Our delivery model and unique approaches harness our deep technical and domain knowledge, providing forward-looking insights and practical solutions to power secure mission acceleration.  SMX is committed to hiring and retaining a diverse workforce. All qualified candidates will receive consideration for employment without regard to disability status, protected veteran status, race, color, age, religion, national origin, citizenship, marital status, sex, sexual orientation, gender identity or expression, pregnancy or genetic information. SMX is an Equal Opportunity/Affirmative Action employer including disability and veterans.  Selected applicant will be subject to a background investigation.   ",NA
11,Data Scientist,"Computer Vision, AI, Machine Learning Engineer","Vetted Security SolutionsSaint Petersburg, FL 33714 (Disston Heights area)",http://www.indeed.com/rc/clk?jk=4a2408ebcdffde5c&bb=E5D0-e-RDhZJMYuphDBGviW6yslm4c7pn06F_YiQqHceTN5SWpH8UrmBBTImcyKQcK6jfkFV_CPJYZfzxbm-iP7zSAIGtfzMcQOxDDiS6QjkKkLP0tWflw%3D%3D&xkcb=SoB367M3CNkCGdQ8MZ1_bzkdCdPP&fccid=1d28e943087f3cab&cmp=Finder-Software-Solutions&ti=Computer+Vision+Engineer&vjs=3,"Profile insightsFind out how your skills align with the job descriptionSkillsDo you have experience in TensorFlow?YesNoEducationDo you have a Master's degree?YesNo Job detailsHere’s how the job details align with your profile.Pay$75,000 - $109,000 a yearJob typeFull-timeShift and scheduleMonday to Friday LocationVetted Security Solutions in Saint Petersburg, FL 33714 BenefitsPulled from the full job description401(k)401(k) matchingDental insuranceHealth insuranceHealth savings accountLife insurancePaid time offShow morechevron down Full job descriptionWhat you will be doing:  You will be designing and implementing algorithms and machine learning models for computer vision applications. Building custom computer vision models to run on edge devices and the cloud. Oversee data collection, model training, and model optimization strategies Implement model strategies Improve upon current models deployed in the field Working on novel labeling methods with the data infrastructure team to reduce labeling costs while improving model outputs  Requirements:  BS/MS in Computer Science or other related field, or an equivalent combination of professional experience and education. 3+ years of industry experience developing algorithms and computer vision models using PyTorch or TensorFlow Experience in NVIDIA Deepstream. Proven history of designing, training, and deploying CNN computer vision models to production. Must have production experience in Computer Vision and Deep Learning. 3+ years of industry experience using OpenCV library and related tools. Deep knowledge of image processing and computer vision. Experience designing and operating labeling systems. Great programming skills in Python along with relevant packages like numpy, scikit-learning, and matplotlib Deep understanding of data structures and algorithms. Strong written and verbal communication and collaboration skills. Developing computer vision models. Experience with ML/AI models (pipeline, inference, or training). Basic SQL skills with databases like MySQL and Microsoft SQL server.  Additional nice-to-have skills:  Familiarity with NVIDIA DeepStream SDK and its main components including TensorRT, Triton Inference Server & Tao Toolkit Experience in deploying CV solutions using NVIDIA Jetsons. Experience with C/C++ Have experience with deep learning libraries and tools like Keras, CUDA, CUDNN, OpenVINO, ONNX. Knowledge of GStreamer. Hands-on coding experience C++ & CUDA.  Job Type: Full-time Pay: $75,000.00 - $109,000.00 per year Benefits:  401(k) 401(k) matching Dental insurance Health insurance Health savings account Life insurance Paid time off Parental leave Vision insurance  Experience level:  3 years  Schedule:  Monday to Friday  Ability to Relocate:  Saint Petersburg, FL 33714: Relocate before starting work (Required)  Work Location: In person ",NA
12,Data Scientist,ML/AI Principal Engineer,"Kid CompanyHybrid remote in Palo Alto, CA 94306",http://www.indeed.com/rc/clk?jk=69c1c6cf36f19790&bb=E5D0-e-RDhZJMYuphDBGvo5FME2hLkGq4JVOAk3GdOi-x2F0bWAjWBkpiEk-ZlvXzx95vvT8fCE-0YQ04oPiOjO20gGhv3XMAEY5AAEP8KsDaHuw7lxVZA%3D%3D&xkcb=SoBe67M3CNkCGdQ8MZ19bzkdCdPP&fccid=ef4d2a1362147d41&cmp=Kid-Company&ti=Ai%2Fml+Engineer&vjs=3,"Profile insightsFind out how your skills align with the job descriptionSkillsDo you have experience in TensorFlow?YesNoEducationDo you have a Master's degree?YesNo Job detailsHere’s how the job details align with your profile.Pay$120,000 - $130,000 a yearJob typeFull-timeShift and scheduleMonday to Friday Location3101 Park Boulevard, Palo Alto, CA 94306 BenefitsPulled from the full job descriptionHealth insurance Full job descriptionJob Posting: ML/AI Principal Engineer Company: Kid Company (www.kidco.ai) Job Title: ML/AI Principal Engineer Location: San Francisco Bay Area, CA Duration: Full-time About Us: Kid Company is a startup founded by Robert LoCascio, who Founded and ran LivePerson for 28 years, which was the leading AI B2B Conversational Commerce company for the enterprise. The mission of KID is to create the world’s best Responsive AI device that taps into the imaginations of people, starting with children, and allows them, through safe AI, be their ""best creators"" of music, art, video and games. Description: We are actively seeking an exceptional Principal Engineer with expertise in Machine Learning AI to lead the development and integration of advanced AI capabilities into our innovative ""Responsive"" AI device. The successful candidate will spearhead the design and implementation of cutting-edge machine learning algorithms and AI technologies to revolutionize the way individuals interact and create with our AI device. Responsibilities: The Principal Engineer will:  Lead the development and integration of machine learning algorithms and AI technologies into our Responsive AI device. Spearhead the design and implementation of advanced AI capabilities to enhance user experiences. Collaborate with cross-functional teams to drive the innovation and evolution of our AI device's AI capabilities. Research and implement state-of-the-art machine learning and AI models to achieve industry-leading performance.  Requirements:  A Bachelor’s or Master's in Computer Science, Electrical Engineering, or a related field with a focus on machine learning, AI, or related disciplines. Proven experience in developing and implementing machine learning algorithms and AI technologies in real-world applications. Expertise in deep learning frameworks such as TensorFlow, PyTorch, or Keras, and proficiency in using them to build and deploy machine learning models. Strong understanding of natural language processing, computer vision, and reinforcement learning. Experience in deploying machine learning models in production environments and optimizing their performance. Proven ability to lead and mentor a team of machine learning engineers and data scientists. Must be in CA area  Benefits:  Competitive salary of $120,000+ per year. Opportunity to work with a pioneering team at the forefront of AI technology.. Professional growth and advancement within the company.  Application Process: If you meet the above qualifications and are passionate about pushing the boundaries of machine learning and AI technology, we encourage you to submit your resume and a detailed cover letter to rona@kidco.ai with the subject line: ""Principal Engineer - Machine Learning AI Application - [Your Name]"". Additionally, we recommend visiting our website kidco.ai to explore the Hiring Pages for current Job Vacancies. Job Type: Full-time Salary: $120,000+ per year Equity: Startup Equity Work Schedule: Monday to Friday in Palo Alto, CA or San Francisco, CA Job Type: Full-time Pay: $120,000.00 - $130,000.00 per year Benefits:  Health insurance  Experience level:  4 years 5 years  Schedule:  Monday to Friday  Work Location: Hybrid remote in Palo Alto, CA 94306 ",NA
13,Data Scientist,Inventory Management Data Scientist,"Clark AssociatesRemote in Lancaster, PA 17602",http://www.indeed.com/rc/clk?jk=77e066b51bf905e7&bb=E5D0-e-RDhZJMYuphDBGviOGKqa5pzcZC_b-kk6Qd0DDVKvxggnI6Mg3D2ykGwTo-raSNcpQpkU27NSZoGN8rwtMAHsRUoEWA0pERs-FI9rBJgiCs2gOPQ%3D%3D&xkcb=SoAD67M3CNkCGdQ8MZ1zbzkdCdPP&fccid=15c26b2f7c7309c1&vjs=3,"Profile insightsFind out how your skills align with the job descriptionSkillsDo you have experience in SQL?YesNoEducationDo you have a Master's degree?YesNo LocationLancaster, PA 17602 Full job description Clark Associates, a distinguished leader in the foodservice equipment and supplies industry, is seeking a dedicated and visionary individual to join our Augmented Inventory Management (AIM) team. As the foremost and rapidly expanding foodservice equipment and supplies dealer in the USA, we leverage a network of over 20 strategically positioned national distribution centers to promptly deliver an extensive catalog of 70,000+ products to our valued customers within an efficient 1-2 business day timeframe.   Role Overview:  As a member of our Augmented Inventory Management team, you will play a pivotal role in shaping the future of inventory management within our dynamic organization. This team, composed of highly analytical professionals, is at the forefront of employing cutting-edge techniques to streamline decision-making processes, enhance accuracy, and achieve remarkable scalability through the integration of machine learning technologies.   Responsibilities:   Model Development: Create advanced statistical, and machine learning models that optimize inventory management processes, fostering efficient allocation and utilization of resources.  Collaboration: Interface with stakeholders in procurement and operations to devise systematic solutions for intricate inventory management challenges.  Continuous Enhancement: Research and implement enhancements to existing models, keeping abreast of emerging methodologies in the field.  Actionable Insights: Extract meaningful insights from data and formulate actionable recommendations that tangibly bolster the company's financial performance.  Solution Validation: Implement robust monitoring mechanisms to validate the efficacy of deployed solutions.    Minimum Qualifications:   Experience: Over 3 years of practical experience using SQL and optimization/statistical/machine learning programming (Python preferred, R and Matlab accepted).  Education: Bachelor's degree in operations research, data science, statistics or a closely related quantitative field; alternatively, over 4 years of experience with an optimization, data, research, or applied science team.  Adaptability: Demonstrated ability to swiftly acclimate to evolving environments, rapidly learn new skills, and apply them to intricate problem-solving scenarios.    Preferred Qualifications:   Supply Chain Expertise: Familiarity with supply chain and warehouse stock optimization practices.  Operations Research Experience: Familiarity with building optimization models (E.g. OR-Tools, CPLEX)  Forecasting Acumen: Exposure to time series forecasting models.  Reporting Proficiency: Experience with reporting tools like Power BI and Excel for sharing results.  Communication: Exceptional written and verbal communication skills with the ability to translate technical processes for non-technical audiences.  Advanced Education: Master's degree in data science, statistics, operations research, industrial engineering, or a closely related highly quantitative field.    Remote work qualifications   Access to a reliable and secure high-speed internet connection. Cable or fiber internet connections (at least 75mbps download/10mbps upload) are preferred, as satellite connections often cannot support the technologies used to perform day-to-day tasks.  Access to a home router and modem.  A dedicated home office space that is noise- and distraction-free. The space should have strong wireless connection or a wired Ethernet connection (wired connection is preferred, if possible).  A valid, physical address (apartment, suite, etc.). PO Boxes are not supported, as a physical address is required for you to receive your computer equipment.  The desire and ability to work and communicate with other team members via chat, webcam, etc.  Legal residents of one of the following states: (). H-1B Visa Sponsorship Not Available, W2 only.   ",NA
14,Data Scientist,Data Scientist - Applied AI (DCC),"TikTokSan Jose, CA 95110 (Downtown area)",http://www.indeed.com/rc/clk?jk=90880c38eee1762e&bb=E5D0-e-RDhZJMYuphDBGvv1Hmy61DVRHb4p3uefS7zpRiFgqkkKf-7IzPGH816zSFSWRiJJyJ93VBtC68rjFK0VkszOKM5_gYeDAmgkPkGMGTRUHNXD5gw%3D%3D&xkcb=SoCk67M3CNkCGdQ8MZ12bzkdCdPP&fccid=caed318a9335aac0&vjs=3,"Profile insightsFind out how your skills align with the job descriptionSkillsDo you have experience in TensorFlow?YesNoEducationDo you have a Bachelor's degree?YesNo LocationSan Jose, CA 95110 BenefitsPulled from the full job description401(k) matchingAD&D insuranceDisability insuranceEmployee assistance programFlexible spending accountHealth insuranceHealth savings accountShow morechevron down Full job descriptionResponsibilities  TikTok is the leading destination for short-form mobile video. Our mission is to inspire creativity and bring joy. TikTok has global offices including Los Angeles, New York, London, Paris, Berlin, Dubai, Singapore, Jakarta, Seoul and Tokyo.    Creation is the core of TikTok's purpose. Our platform is built to help imaginations thrive. This is doubly true of the teams that make TikTok possible. Together, we inspire creativity and bring joy - a mission we all believe in and aim towards achieving every day. To us, every challenge, no matter how difficult, is an opportunity; to learn, to innovate, and to grow as one team. Status quo? Never. Courage? Always.  At TikTok, we create together and grow together. That's how we drive impact - for ourselves, our company, and the communities we serve.  Join us.    About the team  The Applied AI (DCC) Team is part of the Monetizing Integrity team in TikTok global business solutions. We support Data Cycling Center to provide enterprises with affordable and trusted data and models.    Responsibilities:   Design and build core capabilities by leveraging content understanding capabilities, such as natural language processing, machine learning, or computer vision, to extract insights and improve monetization strategies. Develop creative solutions and build prototypes for business problems using algorithms based on the latest deep learning, machine learning, statistics, and optimization techniques Independently manage data projects from 0 to 1, and collaborate with product managers to define user stories, and success metrics to guide the development process Verify the business value and estimated revenue of the project using methods such as AB testing Collaborate with engineering teams to deploy and scale data science solutions  Qualifications    Minimum Qualifications:   BS or above in Computer Science, Software Engineering, Data Science, or a related field Knowledge of underlying mathematical fundamentals in statistics, machine learning, and analytics 3 years experience in data modeling/analysis, with industry experience in ML/DL and one of CV/NLP/Speech Experience with exploratory data analysis, statistical analysis, hypothesis testing, and model development Fluency in SQL, Hive, Presto, or Spark and having experience working with large datasets High proficiency in Python and SQL, and ML/DL frameworks such as TensorFlow, PyTorch  Preferred qualifications:   Experience in CI/CD such as git and cloud services such as AWS/GCP/Azure will be highly desirable Intellectual curiosity, along with excellent problem-solving and quantitative skills, including the ability to desegregate issues, identify root causes and recommend solutions  TikTok is committed to creating an inclusive space where employees are valued for their skills, experiences, and unique perspectives. Our platform connects people from across the globe and so does our workplace. At TikTok, our mission is to inspire creativity and bring joy. To achieve that goal, we are committed to celebrating our diverse voices and to creating an environment that reflects the many communities we reach. We are passionate about this and hope you are too.    TikTok is committed to providing reasonable accommodations in our recruitment processes for candidates with disabilities, pregnancy, sincerely held religious beliefs or other reasons protected by applicable laws. If you need assistance or a reasonable accommodation, please reach out to us at https://shorturl.at/cdpT2  Job Information  The base salary range for this position in the selected city is $128000 - $290000 annually.    ​    Compensation may vary outside of this range depending on a number of factors, including a candidate’s qualifications, skills, competencies and experience, and location. Base pay is one part of the Total Package that is provided to compensate and recognize employees for their work, and this role may be eligible for additional discretionary bonuses/incentives, and restricted stock units.    ​    Our company benefits are designed to convey company culture and values, to create an efficient and inspiring work environment, and to support our employees to give their best in both work and life. We offer the following benefits to eligible employees:    ​    We cover 100% premium coverage for employee medical insurance, approximately 75% premium coverage for dependents and offer a Health Savings Account(HSA) with a company match. As well as Dental, Vision, Short/Long term Disability, Basic Life, Voluntary Life and AD&D insurance plans. In addition to Flexible Spending Account(FSA) Options like Health Care, Limited Purpose and Dependent Care.    ​    Our time off and leave plans are: 10 paid holidays per year plus 17 days of Paid Personal Time Off (PPTO) (prorated upon hire and increased by tenure) and 10 paid sick days per year as well as 12 weeks of paid Parental leave and 8 weeks of paid Supplemental Disability.    ​    We also provide generous benefits like mental and emotional health benefits through our EAP and Lyra. A 401K company match, gym and cellphone service reimbursements. The Company reserves the right to modify or change these benefits programs at any time, with or without notice. ",NA
